{
  "$schema": "https://json-schema.org/draft/2020-12/schema",
  "title": "GoldenCase",
  "description": "One node-jhora accuracy case: input, settings, provenance, and per-path expectations.",
  "type": "object",
  "additionalProperties": false,
  "required": [
    "id",
    "provenance",
    "input",
    "settings",
    "expected"
  ],
  "$defs": {
    "arcsecEntry": {
      "type": "object",
      "properties": {
        "value": {
          "type": "number"
        },
        "tolerance": {
          "type": "object",
          "properties": {
            "type": {
              "type": "string",
              "const": "arcsec"
            },
            "arcsec": {
              "type": "number",
              "minimum": 0
            }
          },
          "required": [
            "type",
            "arcsec"
          ],
          "additionalProperties": false
        }
      },
      "required": [
        "value",
        "tolerance"
      ],
      "additionalProperties": false
    },
    "secondsEntry": {
      "type": "object",
      "properties": {
        "value": {
          "type": [
            "number",
            "string"
          ]
        },
        "tolerance": {
          "type": "object",
          "properties": {
            "type": {
              "type": "string",
              "const": "seconds"
            },
            "seconds": {
              "type": "number",
              "minimum": 0
            }
          },
          "required": [
            "type",
            "seconds"
          ],
          "additionalProperties": false
        }
      },
      "required": [
        "value",
        "tolerance"
      ],
      "additionalProperties": false
    },
    "exactEntry": {
      "type": "object",
      "properties": {
        "value": {
          "type": [
            "number",
            "string",
            "boolean"
          ]
        },
        "tolerance": {
          "type": "object",
          "properties": {
            "type": {
              "type": "string",
              "const": "exact"
            }
          },
          "required": [
            "type"
          ],
          "additionalProperties": false
        }
      },
      "required": [
        "value",
        "tolerance"
      ],
      "additionalProperties": false
    },
    "provenance": {
      "type": "object",
      "properties": {
        "source": {
          "anyOf": [
            {
              "type": "string",
              "enum": [
                "jhora",
                "horizons",
                "pyswisseph",
                "published-text"
              ]
            },
            {
              "type": "string",
              "minLength": 1
            }
          ]
        },
        "toolVersion": {
          "type": "string",
          "minLength": 1
        },
        "capturedAt": {
          "anyOf": [
            {
              "type": "string",
              "pattern": "^\\d{4}-\\d{2}-\\d{2}$"
            },
            {
              "type": "null"
            }
          ]
        },
        "ephemeris": {
          "type": "string",
          "minLength": 1
        },
        "casesFrom": {
          "type": "string",
          "minLength": 1
        }
      },
      "required": [
        "source",
        "toolVersion",
        "capturedAt"
      ],
      "additionalProperties": false
    },
    "input": {
      "type": "object",
      "properties": {
        "instant": {
          "type": "string",
          "pattern": "^\\d{4}-\\d{2}-\\d{2}T\\d{2}:\\d{2}:\\d{2}(?:\\.\\d{1,3})?Z$"
        },
        "timezone": {
          "type": "string",
          "minLength": 1
        },
        "lat": {
          "type": "number",
          "minimum": -90,
          "maximum": 90
        },
        "lon": {
          "type": "number",
          "minimum": -180,
          "maximum": 180
        },
        "alt": {
          "type": "number"
        },
        "settingsPresetId": {
          "type": "string",
          "minLength": 1
        },
        "settingsHash": {
          "type": "string",
          "pattern": "^[a-f0-9]{64}$"
        }
      },
      "required": [
        "instant",
        "timezone",
        "lat",
        "lon",
        "alt",
        "settingsPresetId",
        "settingsHash"
      ],
      "additionalProperties": false
    },
    "settings": {
      "type": "object",
      "propertyNames": {
        "type": "string",
        "pattern": "^[A-Za-z][A-Za-z0-9]*$"
      },
      "additionalProperties": {
        "type": [
          "string",
          "number",
          "boolean"
        ]
      }
    }
  },
  "properties": {
    "id": {
      "type": "string",
      "pattern": "^[a-z0-9][a-z0-9._+-]{0,127}$"
    },
    "provenance": {
      "$ref": "#/$defs/provenance"
    },
    "input": {
      "$ref": "#/$defs/input"
    },
    "settings": {
      "$ref": "#/$defs/settings"
    },
    "expected": {
      "type": "object",
      "minProperties": 1,
      "additionalProperties": false,
      "patternProperties": {
        "^(?:d(?:[1-9]|[1-5]\\d|60)\\.planets\\.(?:Sun|Moon|Mars|Mercury|Jupiter|Venus|Saturn|Uranus|Neptune|Pluto|Rahu|Ketu)\\.(?:lon|lat))$": {
          "$ref": "#/$defs/arcsecEntry"
        },
        "^(?:d(?:[1-9]|[1-5]\\d|60)\\.planets\\.(?:Sun|Moon|Mars|Mercury|Jupiter|Venus|Saturn|Uranus|Neptune|Pluto|Rahu|Ketu)\\.sign)$": {
          "$ref": "#/$defs/exactEntry"
        },
        "^(?:d(?:[1-9]|[1-5]\\d|60)\\.planets\\.(?:Sun|Moon|Mars|Mercury|Jupiter|Venus|Saturn|Uranus|Neptune|Pluto|Rahu|Ketu)\\.printed)$": {
          "$ref": "#/$defs/exactEntry"
        },
        "^(?:d(?:[1-9]|[1-5]\\d|60)\\.planets\\.(?:Sun|Moon|Mars|Mercury|Jupiter|Venus|Saturn|Uranus|Neptune|Pluto|Rahu|Ketu)\\.retrograde)$": {
          "$ref": "#/$defs/exactEntry"
        },
        "^(?:d(?:[1-9]|[1-5]\\d|60)\\.ascendant\\.(?:lon|lat))$": {
          "$ref": "#/$defs/arcsecEntry"
        },
        "^(?:d(?:[1-9]|[1-5]\\d|60)\\.ascendant\\.sign)$": {
          "$ref": "#/$defs/exactEntry"
        },
        "^(?:d(?:[1-9]|[1-5]\\d|60)\\.ascendant\\.printed)$": {
          "$ref": "#/$defs/exactEntry"
        },
        "^(?:ayanamsa\\.value)$": {
          "$ref": "#/$defs/arcsecEntry"
        },
        "^(?:ayanamsa\\.printed)$": {
          "$ref": "#/$defs/exactEntry"
        },
        "^(?:ayanamsa\\.mode)$": {
          "$ref": "#/$defs/exactEntry"
        },
        "^(?:siderealTime\\.hours)$": {
          "$ref": "#/$defs/secondsEntry"
        },
        "^(?:siderealTime\\.printed)$": {
          "$ref": "#/$defs/exactEntry"
        },
        "^(?:panchanga\\.(?:tithi|nakshatra|yoga|karana|vara)\\.name)$": {
          "$ref": "#/$defs/exactEntry"
        },
        "^(?:panchanga\\.(?:tithi|nakshatra|vara)\\.index)$": {
          "$ref": "#/$defs/exactEntry"
        },
        "^(?:panchanga\\.nakshatra\\.pada)$": {
          "$ref": "#/$defs/exactEntry"
        },
        "^(?:panchanga\\.(?:tithi|nakshatra|yoga|karana)\\.percentLeft)$": {
          "$ref": "#/$defs/exactEntry"
        },
        "^(?:meta\\.panchanga\\.tolerancePercent)$": {
          "$ref": "#/$defs/exactEntry"
        },
        "^(?:dasa\\.(?:vimshottari)\\.startLord)$": {
          "$ref": "#/$defs/exactEntry"
        },
        "^(?:dasa\\.(?:vimshottari)(?:\\[\\d+\\]){1,6}\\.lord)$": {
          "$ref": "#/$defs/exactEntry"
        },
        "^(?:dasa\\.(?:vimshottari)(?:\\[\\d+\\]){1,6}\\.(?:start|end))$": {
          "$ref": "#/$defs/secondsEntry"
        },
        "^(?:d10\\.scheme)$": {
          "$ref": "#/$defs/exactEntry"
        },
        "^(?:d10\\.label)$": {
          "$ref": "#/$defs/exactEntry"
        },
        "^(?:d10\\.evenSignBodies\\[\\d+\\])$": {
          "$ref": "#/$defs/exactEntry"
        },
        "^(?:horizons\\.planets\\.(?:Sun|Moon|Mars|Mercury|Jupiter|Venus|Saturn|Uranus|Neptune|Pluto|Rahu|Ketu)\\.(?:lon|lat))$": {
          "$ref": "#/$defs/arcsecEntry"
        },
        "^(?:time\\.jd)$": {
          "$ref": "#/$defs/exactEntry"
        },
        "^(?:meta\\.birth\\.(?:local|utc)\\.(?:year|month|day|hour|minute|second))$": {
          "$ref": "#/$defs/exactEntry"
        },
        "^(?:meta\\.birth\\.utcOffsetHours)$": {
          "$ref": "#/$defs/exactEntry"
        },
        "^(?:meta\\.epoch\\.label)$": {
          "$ref": "#/$defs/exactEntry"
        },
        "^(?:meta\\.epoch\\.bodies\\[\\d+\\])$": {
          "$ref": "#/$defs/exactEntry"
        },
        "^(?:meta\\.contract\\.lastObservedDeltaTYear)$": {
          "$ref": "#/$defs/exactEntry"
        },
        "^(?:meta\\.contract\\.(?:tolerance|futureTolerance)\\.(?:longitude|latitude))$": {
          "$ref": "#/$defs/exactEntry"
        },
        "^(?:meta\\.horizons\\.(?:apiVersion|ephemeris|queryUrlTemplate))$": {
          "$ref": "#/$defs/exactEntry"
        },
        "^(?:meta\\.horizons\\.requestParameters)$": {
          "$ref": "#/$defs/exactEntry"
        },
        "^(?:riseset\\.(?:Sun|Moon|Mars|Mercury|Jupiter|Venus|Saturn|Uranus|Neptune|Pluto|Rahu|Ketu)\\.(?:rise|set|upperTransit|lowerTransit)\\.kind)$": {
          "$ref": "#/$defs/exactEntry"
        },
        "^(?:riseset\\.(?:Sun|Moon|Mars|Mercury|Jupiter|Venus|Saturn|Uranus|Neptune|Pluto|Rahu|Ketu)\\.(?:rise|set|upperTransit|lowerTransit)\\.jdUt)$": {
          "$ref": "#/$defs/secondsEntry"
        }
      }
    }
  }
}
