[
  {
    "id": "hl-sun-19000621-n55",
    "provenance": {
      "source": "pyswisseph",
      "toolVersion": "2.10.03",
      "ephemeris": "sepl_18.se1 + semo_18.se1; default call matches the DE431 fixture to 0.011 s",
      "capturedAt": "2026-10-26",
      "casesFrom": "high-latitude oracle grid, latitudes 55 to 90, years 1900 to 2100"
    },
    "input": {
      "instant": "1900-06-21T00:00:00Z",
      "timezone": "UTC",
      "lat": 55,
      "lon": 128,
      "alt": 0,
      "settingsPresetId": "jhora-default@8.0",
      "settingsHash": "d7bda965501b60ac0e95478954658068018641467cfd6feac47e6322d6d9c913"
    },
    "settings": {
      "limb": "disc_centre",
      "refraction": false,
      "positionMode": "geometric",
      "pressureHPa": 1013.25,
      "temperatureC": 15,
      "horizonAltitudeDeg": 0
    },
    "expected": {
      "riseset.Sun.rise.kind": {
        "value": "time",
        "tolerance": {
          "type": "exact"
        }
      },
      "riseset.Sun.rise.jdUt": {
        "value": 2415192.289150463,
        "tolerance": {
          "type": "seconds",
          "seconds": 1
        }
      },
      "riseset.Sun.set.kind": {
        "value": "time",
        "tolerance": {
          "type": "exact"
        }
      },
      "riseset.Sun.set.jdUt": {
        "value": 2415192.0017505786,
        "tolerance": {
          "type": "seconds",
          "seconds": 1
        }
      },
      "riseset.Sun.upperTransit.kind": {
        "value": "time",
        "tolerance": {
          "type": "exact"
        }
      },
      "riseset.Sun.upperTransit.jdUt": {
        "value": 2415191.6453767363,
        "tolerance": {
          "type": "seconds",
          "seconds": 1
        }
      },
      "riseset.Sun.lowerTransit.kind": {
        "value": "time",
        "tolerance": {
          "type": "exact"
        }
      },
      "riseset.Sun.lowerTransit.jdUt": {
        "value": 2415192.1454518517,
        "tolerance": {
          "type": "seconds",
          "seconds": 1
        }
      }
    }
  },
  {
    "id": "hl-sun-19000621-n90",
    "provenance": {
      "source": "pyswisseph",
      "toolVersion": "2.10.03",
      "ephemeris": "sepl_18.se1 + semo_18.se1; default call matches the DE431 fixture to 0.011 s",
      "capturedAt": "2026-10-26",
      "casesFrom": "high-latitude oracle grid, latitudes 55 to 90, years 1900 to 2100"
    },
    "input": {
      "instant": "1900-06-21T00:00:00Z",
      "timezone": "UTC",
      "lat": 90,
      "lon": 118,
      "alt": 0,
      "settingsPresetId": "jhora-default@8.0",
      "settingsHash": "d7bda965501b60ac0e95478954658068018641467cfd6feac47e6322d6d9c913"
    },
    "settings": {
      "limb": "disc_centre",
      "refraction": false,
      "positionMode": "geometric",
      "pressureHPa": 1013.25,
      "temperatureC": 15,
      "horizonAltitudeDeg": 0
    },
    "expected": {
      "riseset.Sun.rise.kind": {
        "value": "none",
        "tolerance": {
          "type": "exact"
        }
      },
      "riseset.Sun.set.kind": {
        "value": "none",
        "tolerance": {
          "type": "exact"
        }
      },
      "riseset.Sun.upperTransit.kind": {
        "value": "time",
        "tolerance": {
          "type": "exact"
        }
      },
      "riseset.Sun.upperTransit.jdUt": {
        "value": 2415191.673158565,
        "tolerance": {
          "type": "seconds",
          "seconds": 1
        }
      },
      "riseset.Sun.lowerTransit.kind": {
        "value": "time",
        "tolerance": {
          "type": "exact"
        }
      },
      "riseset.Sun.lowerTransit.jdUt": {
        "value": 2415192.173233912,
        "tolerance": {
          "type": "seconds",
          "seconds": 1
        }
      }
    }
  },
  {
    "id": "hl-moon-19000621-s90",
    "provenance": {
      "source": "pyswisseph",
      "toolVersion": "2.10.03",
      "ephemeris": "sepl_18.se1 + semo_18.se1; default call matches the DE431 fixture to 0.011 s",
      "capturedAt": "2026-10-26",
      "casesFrom": "high-latitude oracle grid, latitudes 55 to 90, years 1900 to 2100"
    },
    "input": {
      "instant": "1900-06-21T00:00:00Z",
      "timezone": "UTC",
      "lat": -90,
      "lon": 118,
      "alt": 0,
      "settingsPresetId": "jhora-default@8.0",
      "settingsHash": "d7bda965501b60ac0e95478954658068018641467cfd6feac47e6322d6d9c913"
    },
    "settings": {
      "limb": "disc_centre",
      "refraction": false,
      "positionMode": "geometric",
      "pressureHPa": 1013.25,
      "temperatureC": 15,
      "horizonAltitudeDeg": 0
    },
    "expected": {
      "riseset.Moon.rise.kind": {
        "value": "none",
        "tolerance": {
          "type": "exact"
        }
      },
      "riseset.Moon.set.kind": {
        "value": "none",
        "tolerance": {
          "type": "exact"
        }
      },
      "riseset.Moon.upperTransit.kind": {
        "value": "time",
        "tolerance": {
          "type": "exact"
        }
      },
      "riseset.Moon.upperTransit.jdUt": {
        "value": 2415192.48550544,
        "tolerance": {
          "type": "seconds",
          "seconds": 1
        }
      },
      "riseset.Moon.lowerTransit.kind": {
        "value": "time",
        "tolerance": {
          "type": "exact"
        }
      },
      "riseset.Moon.lowerTransit.jdUt": {
        "value": 2415191.967277199,
        "tolerance": {
          "type": "seconds",
          "seconds": 1
        }
      }
    }
  },
  {
    "id": "hl-mercury-19501221-n60",
    "provenance": {
      "source": "pyswisseph",
      "toolVersion": "2.10.03",
      "ephemeris": "sepl_18.se1 + semo_18.se1; default call matches the DE431 fixture to 0.011 s",
      "capturedAt": "2026-10-26",
      "casesFrom": "high-latitude oracle grid, latitudes 55 to 90, years 1900 to 2100"
    },
    "input": {
      "instant": "1950-12-21T00:00:00Z",
      "timezone": "UTC",
      "lat": 60,
      "lon": -114,
      "alt": 0,
      "settingsPresetId": "jhora-default@8.0",
      "settingsHash": "d7bda965501b60ac0e95478954658068018641467cfd6feac47e6322d6d9c913"
    },
    "settings": {
      "limb": "disc_centre",
      "refraction": false,
      "positionMode": "geometric",
      "pressureHPa": 1013.25,
      "temperatureC": 15,
      "horizonAltitudeDeg": 0
    },
    "expected": {
      "riseset.Mercury.rise.kind": {
        "value": "time",
        "tolerance": {
          "type": "exact"
        }
      },
      "riseset.Mercury.rise.jdUt": {
        "value": 2433637.2526214123,
        "tolerance": {
          "type": "seconds",
          "seconds": 1
        }
      },
      "riseset.Mercury.set.kind": {
        "value": "time",
        "tolerance": {
          "type": "exact"
        }
      },
      "riseset.Mercury.set.jdUt": {
        "value": 2433637.490418287,
        "tolerance": {
          "type": "seconds",
          "seconds": 1
        }
      },
      "riseset.Mercury.upperTransit.kind": {
        "value": "time",
        "tolerance": {
          "type": "exact"
        }
      },
      "riseset.Mercury.upperTransit.jdUt": {
        "value": 2433637.3712420138,
        "tolerance": {
          "type": "seconds",
          "seconds": 1
        }
      },
      "riseset.Mercury.lowerTransit.kind": {
        "value": "time",
        "tolerance": {
          "type": "exact"
        }
      },
      "riseset.Mercury.lowerTransit.jdUt": {
        "value": 2433636.872146875,
        "tolerance": {
          "type": "seconds",
          "seconds": 1
        }
      }
    }
  },
  {
    "id": "hl-venus-19501221-n60p5",
    "provenance": {
      "source": "pyswisseph",
      "toolVersion": "2.10.03",
      "ephemeris": "sepl_18.se1 + semo_18.se1; default call matches the DE431 fixture to 0.011 s",
      "capturedAt": "2026-10-26",
      "casesFrom": "high-latitude oracle grid, latitudes 55 to 90, years 1900 to 2100"
    },
    "input": {
      "instant": "1950-12-21T00:00:00Z",
      "timezone": "UTC",
      "lat": 60.5,
      "lon": -109,
      "alt": 0,
      "settingsPresetId": "jhora-default@8.0",
      "settingsHash": "d7bda965501b60ac0e95478954658068018641467cfd6feac47e6322d6d9c913"
    },
    "settings": {
      "limb": "disc_centre",
      "refraction": false,
      "positionMode": "geometric",
      "pressureHPa": 1013.25,
      "temperatureC": 15,
      "horizonAltitudeDeg": 0
    },
    "expected": {
      "riseset.Venus.rise.kind": {
        "value": "time",
        "tolerance": {
          "type": "exact"
        }
      },
      "riseset.Venus.rise.jdUt": {
        "value": 2433637.2236478007,
        "tolerance": {
          "type": "seconds",
          "seconds": 1
        }
      },
      "riseset.Venus.set.kind": {
        "value": "time",
        "tolerance": {
          "type": "exact"
        }
      },
      "riseset.Venus.set.jdUt": {
        "value": 2433637.4353770833,
        "tolerance": {
          "type": "seconds",
          "seconds": 1
        }
      },
      "riseset.Venus.upperTransit.kind": {
        "value": "time",
        "tolerance": {
          "type": "exact"
        }
      },
      "riseset.Venus.upperTransit.jdUt": {
        "value": 2433637.3294270835,
        "tolerance": {
          "type": "seconds",
          "seconds": 1
        }
      },
      "riseset.Venus.lowerTransit.kind": {
        "value": "time",
        "tolerance": {
          "type": "exact"
        }
      },
      "riseset.Venus.lowerTransit.jdUt": {
        "value": 2433636.8288855324,
        "tolerance": {
          "type": "seconds",
          "seconds": 1
        }
      }
    }
  },
  {
    "id": "hl-mars-19841206-n65",
    "provenance": {
      "source": "pyswisseph",
      "toolVersion": "2.10.03",
      "ephemeris": "sepl_18.se1 + semo_18.se1; default call matches the DE431 fixture to 0.011 s",
      "capturedAt": "2026-10-26",
      "casesFrom": "high-latitude oracle grid, latitudes 55 to 90, years 1900 to 2100"
    },
    "input": {